tcpdump udp port 26000 and host 192.168.1.140

正常情况
17:54:02.249438 IP 192.168.1.140.26291 > 192.168.1.14.quake: UDP, length 121
17:54:02.250042 IP 192.168.1.14.quake > 192.168.1.140.26291: UDP, length 4572
17:54:02.989439 IP 192.168.1.140.30621 > 192.168.1.14.quake: UDP, length 121
17:54:02.990013 IP 192.168.1.14.quake > 192.168.1.140.30621: UDP, length 4572
17:54:03.705632 IP 192.168.1.140.24072 > 192.168.1.14.quake: UDP, length 121
17:54:03.706224 IP 192.168.1.14.quake > 192.168.1.140.24072: UDP, length 4572
17:54:04.220340 IP 192.168.1.140.41156 > 192.168.1.14.quake: UDP, length 121
17:54:04.220988 IP 192.168.1.14.quake > 192.168.1.140.41156: UDP, length 4572
17:54:04.681316 IP 192.168.1.140.62127 > 192.168.1.14.quake: UDP, length 121
17:54:04.681944 IP 192.168.1.14.quake > 192.168.1.140.62127: UDP, length 4572
17:54:05.199684 IP 192.168.1.140.12352 > 192.168.1.14.quake: UDP, length 121
17:54:05.200402 IP 192.168.1.14.quake > 192.168.1.140.12352: UDP, length 4572
17:54:05.719435 IP 192.168.1.140.54427 > 192.168.1.14.quake: UDP, length 121
17:54:05.720083 IP 192.168.1.14.quake > 192.168.1.140.54427: UDP, length 4572
17:54:06.227500 IP 192.168.1.140.32880 > 192.168.1.14.quake: UDP, length 121
17:54:06.228048 IP 192.168.1.14.quake > 192.168.1.140.32880: UDP, length 4572
17:54:06.626339 IP 192.168.1.140.55511 > 192.168.1.14.quake: UDP, length 121
17:54:06.626974 IP 192.168.1.14.quake > 192.168.1.140.55511: UDP, length 4572
17:54:07.226542 IP 192.168.1.140.34686 > 192.168.1.14.quake: UDP, length 121
17:54:07.227056 IP 192.168.1.14.quake > 192.168.1.140.34686: UDP, length 4572

丢包情况
17:50:40.844560 IP 192.168.1.140.42621 > 192.168.1.14.quake: UDP, length 64
17:50:43.824553 IP 192.168.1.140.61578 > 192.168.1.14.quake: UDP, length 70
17:50:44.019550 IP 192.168.1.140.59925 > 192.168.1.14.quake: UDP, length 70
17:50:45.438779 IP 192.168.1.140.57465 > 192.168.1.14.quake: UDP, length 70
17:50:48.711537 IP 192.168.1.140.48311 > 192.168.1.14.quake: UDP, length 70
17:50:51.620813 IP 192.168.1.140.48994 > 192.168.1.14.quake: UDP, length 70
17:50:51.810684 IP 192.168.1.140.40351 > 192.168.1.14.quake: UDP, length 70
17:50:54.235548 IP 192.168.1.140.15577 > 192.168.1.14.quake: UDP, length 70
17:50:54.438720 IP 192.168.1.140.13884 > 192.168.1.14.quake: UDP, length 70
17:50:56.645733 IP 192.168.1.140.35246 > 192.168.1.14.quake: UDP, length 70
17:50:56.791010 IP 192.168.1.140.30148 > 192.168.1.14.quake: UDP, length 70
17:51:01.307550 IP 192.168.1.140.51798 > 192.168.1.14.quake: UDP, length 70
17:51:01.442833 IP 192.168.1.140.10838 > 192.168.1.14.quake: UDP, length 70
17:51:02.767964 IP 192.168.1.140.61898 > 192.168.1.14.quake: UDP, length 70
17:51:04.994968 IP 192.168.1.140.49467 > 192.168.1.14.quake: UDP, length 70
17:51:05.131918 IP 192.168.1.140.46652 > 192.168.1.14.quake: UDP, length 70
17:51:07.968752 IP 192.168.1.140.29489 > 192.168.1.14.quake: UDP, length 87
17:51:07.969026 IP 192.168.1.14.quake > 192.168.1.140.29489: UDP, length 510
17:51:08.034845 IP 192.168.1.140.11543 > 192.168.1.14.quake: UDP, length 130
17:51:08.035504 IP 192.168.1.14.quake > 192.168.1.140.11543: UDP, length 4572
17:51:08.728938 IP 192.168.1.140.63002 > 192.168.1.14.quake: UDP, length 125
17:51:08.861810 IP 192.168.1.14.quake > 192.168.1.140.63002: UDP, length 1706


调试后发现，这些包是统计包，无需返回
[2013-05-10 09:48:31][MESSAGE][parse.c:198 parse_event] 70 ename qact cmd 1015 flag 0
[2013-05-10 09:48:32][MESSAGE][parse.c:198 parse_event] 70 ename qact cmd 1017 flag 0
[2013-05-10 09:48:33][MESSAGE][parse.c:198 parse_event] 70 ename qact cmd 1015 flag 0
[2013-05-10 09:48:33][MESSAGE][parse.c:198 parse_event] 70 ename qact cmd 1017 flag 0
[2013-05-10 09:48:34][MESSAGE][parse.c:198 parse_event] 70 ename qact cmd 1015 flag 0
[2013-05-10 09:48:34][MESSAGE][parse.c:198 parse_event] 70 ename qact cmd 1015 flag 0
[2013-05-10 09:48:34][MESSAGE][parse.c:198 parse_event] 70 ename qact cmd 1017 flag 0
[2013-05-10 09:48:37][MESSAGE][parse.c:198 parse_event] 70 ename qact cmd 1015 flag 0
[2013-05-10 09:48:37][MESSAGE][parse.c:198 parse_event] 70 ename qact cmd 1017 flag 0
[2013-05-10 09:48:37][MESSAGE][parse.c:198 parse_event] 70 ename qact cmd 1015 flag 0
